,stop_code,stop_name,stop_lat,stop_lon,geometry
613,103643,Glenrosa Rd at Dunfield Rd,49.8242,-119.65376,POINT (-119.65376 49.8242)
614,103595,Old Okanagan Hwy at Drought Rd,49.83014,-119.62535,POINT (-119.62535 49.83014)
615,103584,3600 Blk Old Okanagan Hwy,49.83343,-119.62537,POINT (-119.62537 49.83343)
616,103563,Old Okanagan Hwy at Butt Rd,49.8371,-119.6254,POINT (-119.6254 49.8371)
617,103551,Old Okanagan Hwy at Chieftain Rd,49.8403,-119.62544,POINT (-119.62544 49.8403)
618,103541,3300 Blk Old Okanagan Hwy,49.84244,-119.62545,POINT (-119.62545 49.84244)
619,103516,Shannon Lake Rd at Old Okanagan Hwy,49.84616,-119.62221,POINT (-119.62221 49.84616)
620,103493,Shannon Lake Rd at Shannon Way,49.84953,-119.61979,POINT (-119.61979 49.84953)
621,140170,Shannon Way at Westville Way,49.84892,-119.6154,POINT (-119.6154 49.84892)
622,140193,Woodstock Dr at Sandstone Dr,49.85024,-119.61384,POINT (-119.61384 49.85024)
623,140194,Shannon Ridge Dr at Ridge Pl,49.85339,-119.61379,POINT (-119.61379 49.85339)
624,140195,Shannon Ridge Dr at Shannon Green Crt,49.85472,-119.61117,POINT (-119.61117 49.85472)
625,140177,2200 Blk Shannon Ridge Dr,49.85579,-119.60559,POINT (-119.60559 49.85579)
626,140179,2900 Blk Auburn Rd,49.85562,-119.60073,POINT (-119.60073 49.85562)
627,140168,Daimler Dr at Auburn Rd,49.85732,-119.59814,POINT (-119.59814 49.85732)
628,140182,Byland Rd at Compass Crt,49.86075,-119.58947,POINT (-119.58947 49.86075)
629,103265,Ross Rd at Brentwood Rd,49.86081,-119.5774,POINT (-119.5774 49.86081)
630,103279,Ross Rd at Applegreen Crt,49.86082,-119.58009,POINT (-119.58009 49.86082)
631,103301,Ross Rd at Riffington Pl,49.86086,-119.58389,POINT (-119.58389 49.86086)
632,140202,Byland Rd at Compass Crt,49.86083,-119.58954,POINT (-119.58954 49.86083)
633,140203,Byland Rd at Kyle Rd,49.85816,-119.59337,POINT (-119.59337 49.85816)
634,140209,Daimler Dr at Auburn Rd,49.85751,-119.5984,POINT (-119.5984 49.85751)
635,140199,Auburn Rd at Shelby Cres,49.85639,-119.60087,POINT (-119.60087 49.85639)
636,140200,Auburn Rd at Shannon Ridge Dr,49.85377,-119.60086,POINT (-119.60086 49.85377)
637,140198,2200 Blk Shannon Ridge Dr,49.85589,-119.6056,POINT (-119.6056 49.85589)
638,140208,Shannon Ridge Dr at Shannon Green Crt,49.85453,-119.61203,POINT (-119.61203 49.85453)
639,140207,Shannon Ridge Dr at Lakeside Crt,49.85361,-119.61363,POINT (-119.61363 49.85361)
640,103471,Woodstock Dr at Shannon Crt,49.85085,-119.6149,POINT (-119.6149 49.85085)
641,103469,Woodstock Dr at Sandstone Dr,49.84963,-119.6137,POINT (-119.6137 49.84963)
642,103481,Shannon Way at Westville Way,49.84902,-119.6156,POINT (-119.6156 49.84902)
643,103495,Shannon Lake Rd at Shannon Way,49.84942,-119.6201,POINT (-119.6201 49.84942)
644,103513,Shannon Lake Rd at Old Okanagan Hwy,49.8466,-119.6224,POINT (-119.6224 49.8466)
645,103542,3300 Blk Old Okanagan Hwy,49.84236,-119.62557,POINT (-119.62557 49.84236)
646,103552,Old Okanagan Hwy at Chieftain Rd,49.84021,-119.62556,POINT (-119.62556 49.84021)
647,103556,Old Okanagan Hwy at Quince Rd,49.8383,-119.62555,POINT (-119.62555 49.8383)
648,103565,Old Okanagan Hwy at Butt Rd,49.83656,-119.62553,POINT (-119.62553 49.83656)
649,103575,Old Okanagan Hwy at Bering Rd,49.83419,-119.62551,POINT (-119.62551 49.83419)
650,103593,Old Okanagan Hwy at Drought Rd,49.83067,-119.62549,POINT (-119.62549 49.83067)
651,103597,Main St at Hoskins Rd,49.82964,-119.62627,POINT (-119.62627 49.82964)
652,103596,Dobbin Rd at Old Okanagan Hwy,49.82867,-119.62476,POINT (-119.62476 49.82867)
653,103581,Gellatly Rd at Carrington Rd,49.82941,-119.62109,POINT (-119.62109 49.82941)
654,103580,Gellatly Rd at Witt Rd,49.82736,-119.61874,POINT (-119.61874 49.82736)
655,103586,Boucherie Rd at Gellatly Rd,49.82381,-119.61586,POINT (-119.61586 49.82381)
656,103065,Boucherie Rd at Carrall Rd,49.82514,-119.60949,POINT (-119.60949 49.82514)
657,103529,2040 Blk Boucherie Rd,49.82626,-119.60476,POINT (-119.60476 49.82626)
658,103519,2030 Blk Boucherie Rd,49.82671,-119.60205,POINT (-119.60205 49.82671)
659,103500,Old Boucherie Rd at Boucherie Rd,49.82767,-119.59875,POINT (-119.59875 49.82767)
660,103492,1900 Blk Old Boucherie Rd,49.8277,-119.59702,POINT (-119.59702 49.8277)
661,103484,Old Boucherie Rd at Hitchner Rd,49.82774,-119.59299,POINT (-119.59299 49.82774)
662,103467,Old Boucherie Rd at Pritchard Dr,49.82781,-119.58937,POINT (-119.58937 49.82781)
663,103452,Boucherie Rd at Pritchard Dr,49.83094,-119.58828,POINT (-119.58828 49.83094)
664,103418,Boucherie Rd at Green Bay Rd,49.83474,-119.57944,POINT (-119.57944 49.83474)
665,103351,Boucherie Rd at Mission Hill Rd,49.84013,-119.57359,POINT (-119.57359 49.84013)
666,103302,Boucherie Rd at Sunnyside Rd,49.84387,-119.56543,POINT (-119.56543 49.84387)
667,103266,Boucherie Rd at Gregory Rd,49.84694,-119.55991,POINT (-119.55991 49.84694)
668,103239,Boucherie Rd at Montigny Rd,49.84895,-119.55707,POINT (-119.55707 49.84895)
669,103217,Ogden Rd at Boucherie Rd,49.85288,-119.55563,POINT (-119.55563 49.85288)
670,103195,Thacker Dr at Beverly Pl,49.85252,-119.54781,POINT (-119.54781 49.85252)
671,103181,Thacker Dr at Collens Hill Rd,49.85383,-119.54566,POINT (-119.54566 49.85383)
672,103160,Thacker Dr at Douglas Rd,49.8564,-119.54544,POINT (-119.54544 49.8564)
673,103135,Anders Rd at Thacker Dr,49.86003,-119.54574,POINT (-119.54574 49.86003)
674,103164,Anders Rd at Olalla Rd,49.86031,-119.55198,POINT (-119.55198 49.86031)
675,103183,Hudson Rd at Boucherie Rd,49.86245,-119.55688,POINT (-119.55688 49.86245)
676,140065,Hudson Rd at Concord Rd,49.86268,-119.56288,POINT (-119.56288 49.86268)
677,103220,Alhambra Dr at Brentwood Rd,49.86203,-119.56697,POINT (-119.56697 49.86203)
678,103234,Brentwood Rd at Denny Crt,49.86127,-119.56926,POINT (-119.56926 49.86127)
679,103249,Brentwood Rd at Applewood Rd,49.86146,-119.57255,POINT (-119.57255 49.86146)
680,103299,Ross Rd at Cameron Rd,49.86073,-119.58302,POINT (-119.58302 49.86073)
681,103282,Ross Rd at Applegreen Crt,49.86076,-119.58012,POINT (-119.58012 49.86076)
682,103261,Brentwood Rd at Vista Way,49.8614,-119.57523,POINT (-119.57523 49.8614)
683,103254,Brentwood Rd at Applewood Rd,49.86137,-119.57259,POINT (-119.57259 49.86137)
684,103233,Brentwood Rd at Denny Crt,49.86118,-119.5693,POINT (-119.5693 49.86118)
685,103219,Alhambra Dr at Brentwood Rd,49.86201,-119.56683,POINT (-119.56683 49.86201)
686,140066,Hudson Rd at Westlake Rd,49.86265,-119.56391,POINT (-119.56391 49.86265)
687,103180,Hudson Rd at Boucherie Rd,49.86235,-119.5565,POINT (-119.5565 49.86235)
688,103163,Anders Rd at Olalla Rd,49.86016,-119.55063,POINT (-119.55063 49.86016)
689,103134,Anders Rd at Thacker Dr,49.85992,-119.54544,POINT (-119.54544 49.85992)
690,103167,Thacker Dr at Douglas Rd,49.85579,-119.5457,POINT (-119.5457 49.85579)
691,103182,Thacker Dr at Collens Hill Rd,49.85383,-119.54591,POINT (-119.54591 49.85383)
692,103197,Thacker Dr at Beverly Pl,49.85268,-119.54852,POINT (-119.54852 49.85268)
693,103216,Ogden Rd at Boucherie Rd,49.853,-119.55566,POINT (-119.55566 49.853)
694,103244,Boucherie Rd at Montigny Rd,49.84871,-119.55757,POINT (-119.55757 49.84871)
695,103268,Boucherie Rd at Gregory Rd,49.84647,-119.56099,POINT (-119.56099 49.84647)
696,103306,Boucherie Rd at Sunnyside Rd,49.84366,-119.56609,POINT (-119.56609 49.84366)
697,103359,Boucherie Rd at Mission Hill Rd,49.83973,-119.57402,POINT (-119.57402 49.83973)
698,103417,Boucherie Rd at Green Bay Rd,49.835,-119.5793,POINT (-119.5793 49.835)
699,103460,Pritchard Dr at Boucherie Rd,49.83058,-119.58902,POINT (-119.58902 49.83058)
700,103474,Old Boucherie Rd at Pritchard Dr,49.82791,-119.58995,POINT (-119.58995 49.82791)
701,103486,Old Boucherie Rd at Hitchner Rd,49.82783,-119.59359,POINT (-119.59359 49.82783)
702,103491,1900 Blk Old Boucherie Rd,49.82781,-119.59699,POINT (-119.59699 49.82781)
703,103510,Boucherie Rd at Sonoma Pines Dr,49.82765,-119.60019,POINT (-119.60019 49.82765)
704,103518,2030 Blk Boucherie Rd,49.82678,-119.60213,POINT (-119.60213 49.82678)
705,103532,2040 Blk Boucherie Rd,49.82617,-119.60524,POINT (-119.60524 49.82617)
706,103553,Boucherie Rd at Carrall Rd East Side,49.82524,-119.60947,POINT (-119.60947 49.82524)
707,103566,Boucherie Rd at Carrall Rd West Side,49.82474,-119.61267,POINT (-119.61267 49.82474)
708,103590,Boucherie Rd at Gellatly Rd,49.82377,-119.61659,POINT (-119.61659 49.82377)
709,103582,Gellatly Rd at Witt Rd,49.82757,-119.619,POINT (-119.619 49.82757)
710,103579,Gellatly Rd at Carrington Rd,49.82888,-119.62044,POINT (-119.62044 49.82888)
711,103328,Ross Rd at Bartley Rd,49.8602,-119.58971,POINT (-119.58971 49.8602)
712,103381,Ross Rd at Daimler Dr,49.85618,-119.594,POINT (-119.594 49.85618)
713,103395,Old Okanagan Hwy at Daimler Dr,49.85604,-119.59671,POINT (-119.59671 49.85604)
714,103435,Old Okanagan Hwy at Shamrock Dr,49.84924,-119.60116,POINT (-119.60116 49.84924)
715,103462,Old Okanagan Hwy at Louie Dr,49.84547,-119.60728,POINT (-119.60728 49.84547)
716,104911,Old Okanagan Hwy at Skyview Lane,49.84488,-119.60947,POINT (-119.60947 49.84488)
717,103505,Old Okanagan Hwy at Bayview Dr,49.8436,-119.61734,POINT (-119.61734 49.8436)
718,103672,Huston Rd at Lang Rd,49.79247,-119.70544,POINT (-119.70544 49.79247)
719,103682,Trepanier Bench Rd at Desert Pines Ave,49.78635,-119.71073,POINT (-119.71073 49.78635)
720,103686,Peachland Village Centre,49.78471,-119.71764,POINT (-119.71764 49.78471)
721,103689,13th St at Lake Ave,49.78264,-119.72329,POINT (-119.72329 49.78264)
722,103691,Beach Ave at 11th St,49.78188,-119.7291,POINT (-119.7291 49.78188)
723,103693,Beach Ave at 8th St,49.7805,-119.73201,POINT (-119.73201 49.7805)
724,103694,Beach Ave at 6th St,49.77759,-119.73379,POINT (-119.73379 49.77759)
725,140221,Beach Ave at 4th St,49.77477,-119.73514,POINT (-119.73514 49.77477)
726,103701,Beach Ave at Hwy 97,49.77045,-119.73964,POINT (-119.73964 49.77045)
727,103705,Princeton Ave at Somerset Ave,49.76668,-119.74825,POINT (-119.74825 49.76668)
728,103708,Princeton Ave at Lipsett Ave,49.76466,-119.75171,POINT (-119.75171 49.76466)
729,103710,Princeton Ave at Ellison Ave,49.7623,-119.75708,POINT (-119.75708 49.7623)
730,103712,Princeton Ave at Turner Ave,49.75959,-119.76161,POINT (-119.76161 49.75959)
731,103714,Princeton Ave at Whinton Cres,49.75688,-119.76399,POINT (-119.76399 49.75688)
732,103716,Princeton Ave at Vernon Ave,49.75505,-119.76698,POINT (-119.76698 49.75505)
733,103717,5000 Blk Princeton Ave,49.75376,-119.77165,POINT (-119.77165 49.75376)
734,103719,Princeton Ave at Forest Hill Dr,49.75239,-119.77841,POINT (-119.77841 49.75239)
735,103721,Princeton Ave at Pineridge Rd,49.7521,-119.78355,POINT (-119.78355 49.7521)
736,103723,Princeton Ave at Bradbury St,49.75194,-119.78764,POINT (-119.78764 49.75194)
737,103722,Princeton Ave at Pineridge Rd,49.752,-119.78354,POINT (-119.78354 49.752)
738,103720,Princeton Ave at Keyes Ave,49.75229,-119.77856,POINT (-119.77856 49.75229)
739,103718,5000 Blk Princeton Ave,49.75369,-119.77149,POINT (-119.77149 49.75369)
740,103715,Princeton Ave at Vernon Ave,49.75512,-119.76637,POINT (-119.76637 49.75512)
741,103713,Princeton Ave at Whinton Cres,49.757,-119.76356,POINT (-119.76356 49.757)
742,103711,Princeton Ave at Turner Ave,49.75947,-119.76076,POINT (-119.76076 49.75947)
743,103709,Princeton Ave at Gummow Rd,49.76258,-119.75472,POINT (-119.75472 49.76258)
744,103707,Princeton Ave at Lipsett Ave,49.76471,-119.75143,POINT (-119.75143 49.76471)
745,103706,Princeton Ave at Somerset Ave,49.76624,-119.74866,POINT (-119.74866 49.76624)
746,103703,Princeton Ave at Princess St,49.76884,-119.74467,POINT (-119.74467 49.76884)
747,103700,Beach Ave at Hwy 97,49.77085,-119.73908,POINT (-119.73908 49.77085)
748,140222,Beach Ave at 4th St,49.7747,-119.73506,POINT (-119.73506 49.7747)
749,103695,Beach Ave at 6th St,49.77638,-119.73427,POINT (-119.73427 49.77638)
750,103692,Beach Ave at 11th St,49.78121,-119.73113,POINT (-119.73113 49.78121)
751,104912,Beach Ave at 12th St,49.78188,-119.72608,POINT (-119.72608 49.78188)
752,103690,13th St at Lake Ave,49.7827,-119.72315,POINT (-119.72315 49.7827)
753,103675,Buchanan Rd at Hwy 97,49.78912,-119.70749,POINT (-119.70749 49.78912)
754,103671,Buchanan Rd at Beach Ave,49.79245,-119.70261,POINT (-119.70261 49.79245)
755,103667,Buchanan Rd at Burdekin Lane,49.79458,-119.69935,POINT (-119.69935 49.79458)
756,103528,Old Okanagan Hwy at Shannon Lake Rd,49.84479,-119.62391,POINT (-119.62391 49.84479)
757,103502,Old Okanagan Hwy at Bayview Dr,49.84351,-119.61736,POINT (-119.61736 49.84351)
758,103473,Old Okanagan Hwy at Skyview Lane,49.84478,-119.60989,POINT (-119.60989 49.84478)
759,103459,Old Okanagan Hwy at Louie Dr,49.84551,-119.6064,POINT (-119.6064 49.84551)
760,103434,Old Okanagan Hwy at Shamrock Dr,49.84915,-119.60106,POINT (-119.60106 49.84915)
761,103393,Old Okanagan Hwy at Daimler Dr,49.85604,-119.59657,POINT (-119.59657 49.85604)
762,103379,Ross Rd at Daimler Dr,49.85624,-119.59386,POINT (-119.59386 49.85624)
763,103329,Ross Rd at Bartley Rd,49.86011,-119.58953,POINT (-119.58953 49.86011)
764,103537,Butt Rd at Louie Dr,49.83691,-119.61937,POINT (-119.61937 49.83691)
765,140067,Louie Dr at Butt Rd,49.83779,-119.61573,POINT (-119.61573 49.83779)
766,140068,Louie Dr at Elk Rd,49.84031,-119.61231,POINT (-119.61231 49.84031)
767,103527,Butt Rd at Carrington Rd,49.83535,-119.61439,POINT (-119.61439 49.83535)
768,103508,3500 Blk Carrington Rd,49.83681,-119.61117,POINT (-119.61117 49.83681)
769,103483,Carrington Rd at Elk Rd,49.83844,-119.60908,POINT (-119.60908 49.83844)
770,140117,Elk Rd at Acorn Dr,49.83913,-119.60606,POINT (-119.60606 49.83913)
771,103463,Elk Rd at Cougar Rd,49.839,-119.60133,POINT (-119.60133 49.839)
772,103447,Ridge Estates Dr at Elk Rd,49.8362,-119.59467,POINT (-119.59467 49.8362)
773,140095,East Boundary Rd at Wolfe Rd,49.83921,-119.59181,POINT (-119.59181 49.83921)
774,103422,East Boundary Rd at Elk Rd,49.84047,-119.58896,POINT (-119.58896 49.84047)
775,103403,East Boundary Rd at Vineyard Drive,49.84568,-119.589,POINT (-119.589 49.84568)
776,103388,3100 Blk East Boundary Rd,49.8486,-119.58899,POINT (-119.58899 49.8486)
777,103389,3100 Blk East Boundary Rd,49.84856,-119.58912,POINT (-119.58912 49.84856)
778,103407,East Boundary Rd at Eagle Crt,49.84488,-119.58914,POINT (-119.58914 49.84488)
779,103427,East Boundary Rd at Elk Rd,49.84023,-119.5891,POINT (-119.5891 49.84023)
780,140094,East Boundary Rd at Wolfe Rd,49.8393,-119.5918,POINT (-119.5918 49.8393)
781,103450,Elk Rd at Ridge Estates Dr,49.83628,-119.59588,POINT (-119.59588 49.83628)
782,103465,Elk Rd at Cougar Rd,49.83914,-119.60246,POINT (-119.60246 49.83914)
783,140116,Elk Rd at Acorn Dr,49.83922,-119.60591,POINT (-119.60591 49.83922)
784,103485,Carrington Rd at Elk Rd,49.83866,-119.60907,POINT (-119.60907 49.83866)
785,103509,3500 Blk Carrington Rd,49.83686,-119.6113,POINT (-119.6113 49.83686)
786,103525,Butt Rd at Carrington Rd,49.83557,-119.61434,POINT (-119.61434 49.83557)
787,103497,Louie Dr at Elk Rd,49.84029,-119.61252,POINT (-119.61252 49.84029)
788,103511,Louie Dr at Butt Rd,49.8385,-119.61494,POINT (-119.61494 49.8385)
789,103535,Butt Rd at Louie Dr,49.837,-119.61936,POINT (-119.61936 49.837)
790,103609,Airport Way at Old Vernon Rd,49.96977,-119.38373,POINT (-119.38373 49.96977)
791,103607,Airport Way at Lapointe Dr,49.96419,-119.38187,POINT (-119.38187 49.96419)
792,103574,5600 Blk Airport Way,49.95571,-119.38163,POINT (-119.38163 49.95571)
793,103656,Kelowna Airport,49.95206,-119.3833,POINT (-119.3833 49.95206)
794,103680,Kelowna Airport,49.95212,-119.38314,POINT (-119.38314 49.95212)
795,103569,5600 Blk Airport Way,49.95585,-119.38145,POINT (-119.38145 49.95585)
796,103604,Airport Way at Lapointe Dr,49.96414,-119.38173,POINT (-119.38173 49.96414)
797,103610,Airport Way at Old Vernon Rd,49.9695,-119.38341,POINT (-119.38341 49.9695)
798,103425,Old Vernon Rd at Acland Rd,49.91813,-119.38287,POINT (-119.38287 49.91813)
799,103480,Old Vernon Rd at Morrison Rd,49.91807,-119.36946,POINT (-119.36946 49.91807)
800,103506,Old Vernon Rd at McKenzie Rd,49.91962,-119.36414,POINT (-119.36414 49.91962)
801,103548,Old Vernon Rd at Scotty Creek Rd,49.93301,-119.36409,POINT (-119.36409 49.93301)
802,103561,3600 Blk Old Vernon Rd,49.93716,-119.36407,POINT (-119.36407 49.93716)
803,103576,Old Vernon Rd at Bulman Rd,49.94041,-119.36411,POINT (-119.36411 49.94041)
804,103600,Old Vernon Rd at Black Rd,49.95113,-119.36867,POINT (-119.36867 49.95113)
805,104913,Old Vernon Rd at Teather Rd,49.96147,-119.36886,POINT (-119.36886 49.96147)
806,103620,Old Vernon Rd at Spencer Rd,49.97048,-119.3707,POINT (-119.3707 49.97048)
807,103619,Old Vernon Rd at Spencer Rd,49.97036,-119.3707,POINT (-119.3707 49.97036)
808,103613,Old Vernon Rd at Teather Rd,49.96097,-119.36898,POINT (-119.36898 49.96097)
809,103599,Old Vernon Rd at Black Rd,49.95112,-119.36886,POINT (-119.36886 49.95112)
810,103577,Old Vernon Rd at Bulman Rd,49.94079,-119.36455,POINT (-119.36455 49.94079)
811,103564,3700 Blk Old Vernon Rd,49.93754,-119.36421,POINT (-119.36421 49.93754)
812,103547,Old Vernon Rd at Scotty Creek Rd,49.93322,-119.36423,POINT (-119.36423 49.93322)
813,103503,Old Vernon Rd at McKenzie Rd,49.91962,-119.36428,POINT (-119.36428 49.91962)
814,103478,Old Vernon Rd at Morrison Rd,49.91821,-119.37012,POINT (-119.37012 49.91821)
815,140176,Elliott Rd at Solar Rd,49.8312,-119.63098,POINT (-119.63098 49.8312)
816,140174,Elliott Rd at Springer Lane,49.83371,-119.63103,POINT (-119.63103 49.83371)
817,140172,Elliott Rd at Butt Rd,49.83711,-119.63103,POINT (-119.63103 49.83711)
818,140175,Elliott Rd at Nuefeld Cres,49.84168,-119.63387,POINT (-119.63387 49.84168)
819,140173,Elliott Rd at Reece Rd,49.8443,-119.63392,POINT (-119.63392 49.8443)
820,140196,Smith Creek Rd at Elliott Rd,49.84772,-119.63908,POINT (-119.63908 49.84772)
821,140197,Smith Creek Rd at Wild Horse Dr,49.85124,-119.64235,POINT (-119.64235 49.85124)
822,140167,Copper Ridge Dr at Smith Creek Rd,49.85379,-119.64351,POINT (-119.64351 49.85379)
823,140192,Whispering Hills Dr at Copper Ridge Dr,49.8531,-119.64055,POINT (-119.64055 49.8531)
824,140178,2600 Blk Wild Horse Dr,49.85309,-119.63649,POINT (-119.63649 49.85309)
825,140171,Wild Horse Dr at Bridlehill Dr,49.85374,-119.63274,POINT (-119.63274 49.85374)
826,140183,Ironridge Rd at Ironridge Crt,49.85452,-119.62768,POINT (-119.62768 49.85452)
827,140166,Asquith Rd at Saddleback Way,49.8512,-119.62468,POINT (-119.62468 49.8512)
828,140187,Shannon Lake Rd at Shannon Ridge Dr,49.85308,-119.61752,POINT (-119.61752 49.85308)
829,140189,Shannon Lake Rd at Alexandria Way,49.85531,-119.61792,POINT (-119.61792 49.85531)
830,140188,Shannon Lake Rd at Canyon Crest Dr,49.85823,-119.6168,POINT (-119.6168 49.85823)
831,140190,Shannon Lake Rd at Tallus Ridge Dr,49.86248,-119.61289,POINT (-119.61289 49.86248)
832,140184,Shannon Lake Rd at Golf Course Dr,49.86354,-119.6094,POINT (-119.6094 49.86354)
833,140185,Shannon Lake Rd at Shannon View Dr,49.86596,-119.6049,POINT (-119.6049 49.86596)
834,140186,Shannon Lake Rd at Shannon Lake Dr,49.86691,-119.59986,POINT (-119.59986 49.86691)
835,140169,Shannon Lake Rd at Crystal Dr,49.86732,-119.59091,POINT (-119.59091 49.86732)
836,140201,Bartley Rd at Shannon Lake Rd,49.86403,-119.58783,POINT (-119.58783 49.86403)
837,103262,Ross Rd at Brentwood Rd,49.86189,-119.57587,POINT (-119.57587 49.86189)
838,103258,Ross Rd at Western Rd,49.86368,-119.57583,POINT (-119.57583 49.86368)
839,103251,Ross Rd at Stevens Rd,49.86582,-119.57582,POINT (-119.57582 49.86582)
840,103230,1400 Blk Stevens Rd,49.86627,-119.57189,POINT (-119.57189 49.86627)
841,140069,Stevens Rd at Mcdougall Rd,49.86598,-119.5675,POINT (-119.5675 49.86598)
842,103173,Westlake Rd at Caledonia Way,49.87347,-119.56304,POINT (-119.56304 49.87347)
843,103178,Westlake Rd at Rosewood Dr,49.8777,-119.5663,POINT (-119.5663 49.8777)
844,103161,Westlake Rd at Starlight Cres,49.87915,-119.56426,POINT (-119.56426 49.87915)
845,140153,Westlake Rd at Peak Point Rd,49.88398,-119.56054,POINT (-119.56054 49.88398)
846,103115,Westlake Rd at Horizon Dr,49.88503,-119.55698,POINT (-119.55698 49.88503)
847,103110,Westlake Rd at Keloka Way,49.88711,-119.55568,POINT (-119.55568 49.88711)
848,103094,Parkinson Rd at Westlake Rd,49.89125,-119.55277,POINT (-119.55277 49.89125)
849,140154,Parkinson Rd at Pettman Rd,49.89593,-119.54971,POINT (-119.54971 49.89593)
850,103066,Parkinson Rd at Bear Creek Rd,49.89893,-119.54703,POINT (-119.54703 49.89893)
851,140155,Bear Creek Rd at Vancouver Rd,49.89527,-119.54744,POINT (-119.54744 49.89527)
852,103043,Westside Rd at Bear Creek Rd,49.89228,-119.54262,POINT (-119.54262 49.89228)
853,103047,Westside Rd at Westpoint Park,49.88551,-119.54411,POINT (-119.54411 49.88551)
854,103027,Westside Rd at Nancee Way,49.88307,-119.53813,POINT (-119.53813 49.88307)
855,140013,Sneena Rd at Westside Rd,49.88071,-119.5341,POINT (-119.5341 49.88071)
856,103078,Boucherie Rd at Hayman Rd,49.87266,-119.5447,POINT (-119.5447 49.87266)
857,103162,Boucherie Rd at Stuart Rd,49.86412,-119.5551,POINT (-119.5551 49.86412)
858,140092,Bottom Wood Lake Rd at Powley Crt,50.0383,-119.40293,POINT (-119.40293 50.0383)
859,140091,Bottom Wood Lake Rd at Mayrus Rd,50.04335,-119.40297,POINT (-119.40297 50.04335)
860,140090,Bottom Wood Lake Rd at Wageman Rd,50.04629,-119.40299,POINT (-119.40299 50.04629)
861,140096,Lake Hill Dr at Oceola Rd,50.06138,-119.41821,POINT (-119.41821 50.06138)
862,140080,Lake Hill Dr at Lake Breeze Crt,50.06598,-119.41901,POINT (-119.41901 50.06598)
863,140082,Shoreline Way at Lake Hill Dr,50.07352,-119.41726,POINT (-119.41726 50.07352)
864,140083,Lake Hill Dr at Shoreline Way,50.07171,-119.41646,POINT (-119.41646 50.07171)
865,140084,Stillwater Way at Lake Hill Dr,50.06954,-119.41854,POINT (-119.41854 50.06954)
866,140085,Shoreline Dr at Driftwood Crt,50.06784,-119.41929,POINT (-119.41929 50.06784)
867,140086,Lake Hill Dr at Lake Breeze Crt,50.06626,-119.41895,POINT (-119.41895 50.06626)
868,140087,Lake Hill Dr at Oceola Rd,50.06129,-119.41834,POINT (-119.41834 50.06129)
869,140088,Oceola Rd at Pretty Rd,50.0547,-119.41142,POINT (-119.41142 50.0547)
870,140089,Woodsdale Rd at Turtle Bay Crt,50.04925,-119.40761,POINT (-119.40761 50.04925)
871,140054,Woodsdale Rd at Bottom Wood Lake Rd,50.04924,-119.404,POINT (-119.404 50.04924)
872,140079,Bottom Wood Lake Rd at Wageman Rd,50.04597,-119.40312,POINT (-119.40312 50.04597)
873,140078,Bottom Wood Lake Rd at Mayrus Rd,50.04311,-119.4031,POINT (-119.4031 50.04311)
874,140077,Bottom Wood Lake Rd at Powley Crt,50.03782,-119.40308,POINT (-119.40308 50.03782)
875,140093,Bottom Wood Lake Rd at Berry Rd,50.03032,-119.40192,POINT (-119.40192 50.03032)
876,140014,Bottom Wood Lake Rd at Konschuh Rd,50.02872,-119.40067,POINT (-119.40067 50.02872)
877,140015,Bottom Wood Lake Rd at Seniors Centre,50.02447,-119.39926,POINT (-119.39926 50.02447)
878,140016,Beaver Lake Rd at Jensen Rd,50.02018,-119.40119,POINT (-119.40119 50.02018)
879,140017,Main St at Hill Rd,50.02083,-119.40426,POINT (-119.40426 50.02083)
880,140180,Bartley Rd at Byland Rd,49.86302,-119.58757,POINT (-119.58757 49.86302)
881,140210,Shannon Lake Rd at Crystal Dr,49.86869,-119.59306,POINT (-119.59306 49.86869)
882,140212,Shannon Lake Rd at Shannon Woods Dr,49.86578,-119.60611,POINT (-119.60611 49.86578)
883,140191,Shannon Lake Rd at Tallus Ridge Dr,49.86323,-119.612,POINT (-119.612 49.86323)
884,140205,Shannon Lake Rd at Canyon Crest Dr,49.85825,-119.61694,POINT (-119.61694 49.85825)
885,140204,Shannon Lake Rd at Alexandria Way,49.85515,-119.61803,POINT (-119.61803 49.85515)
886,140206,Shannon Lake Rd at Asquith Rd,49.85159,-119.61851,POINT (-119.61851 49.85159)
887,140058,Asquith Rd at Saddleback Way,49.8507,-119.62354,POINT (-119.62354 49.8507)
888,140059,Ironridge Rd at Ironridge Pl,49.8545,-119.62783,POINT (-119.62783 49.8545)
889,140060,Wild Horse Dr at Bridlehill Dr East Side,49.85388,-119.63302,POINT (-119.63302 49.85388)
890,140061,Wild Horse Dr at Bridlehill Dr West Side,49.85346,-119.63555,POINT (-119.63555 49.85346)
891,140062,Whispering Hills Dr at Wild Horse Dr,49.85228,-119.64166,POINT (-119.64166 49.85228)
892,140063,Copper Ridge Dr at Smith Creek Rd,49.85389,-119.64384,POINT (-119.64384 49.85389)
893,140064,Smith Creek Rd at Sugosa Pl,49.85176,-119.6431,POINT (-119.6431 49.85176)
894,103589,Smith Creek Rd at Elliott Rd,49.84782,-119.63926,POINT (-119.63926 49.84782)
895,103573,Elliott Rd at Reece Rd,49.84423,-119.63405,POINT (-119.63405 49.84423)
896,103585,Elliott Rd at Nuefeld Cres,49.84199,-119.63402,POINT (-119.63402 49.84199)
897,103594,Elliott Rd at Butt Rd,49.83642,-119.63117,POINT (-119.63117 49.83642)
898,103598,3600 Blk Elliott Rd,49.83354,-119.63114,POINT (-119.63114 49.83354)
899,103602,Elliott Rd at Delray Rd,49.83015,-119.63108,POINT (-119.63108 49.83015)
900,103457,Okanagan College Exchange Bay C,49.86095,-119.4812,POINT (-119.4812 49.86095)
901,103038,K.L.O. Rd at Gordon Dr,49.86091,-119.47554,POINT (-119.47554 49.86091)
902,103045,K.L.O. Rd at Holland Rd,49.86091,-119.47253,POINT (-119.47253 49.86091)
903,103059,K.L.O. Rd at St Amand Rd,49.8609,-119.46676,POINT (-119.46676 49.8609)
904,103088,K.L.O. Rd at Benvoulin Rd West Side,49.86088,-119.45995,POINT (-119.45995 49.86088)
905,103084,K.L.O. Rd at Benvoulin Rd West Side,49.86104,-119.45854,POINT (-119.45854 49.86104)
906,103042,K.L.O. Rd at Holland Rd,49.86109,-119.47275,POINT (-119.47275 49.86109)
907,103039,Lanfranco Rd at Lakeshore Rd,49.85815,-119.4903,POINT (-119.4903 49.85815)
908,103326,Dougall Rd N at McIntosh Rd,49.89262,-119.39273,POINT (-119.39273 49.89262)
909,103335,Leathead Rd at Asher Rd,49.8953,-119.39157,POINT (-119.39157 49.8953)
910,103375,Rutland Rd N at Hardie Rd,49.89512,-119.38697,POINT (-119.38697 49.89512)
911,140181,Byland Rd at Kyle Rd,49.85908,-119.5919,POINT (-119.5919 49.85908)
912,103844,Princeton Ave at Pierce St,49.75315,-119.7902,POINT (-119.7902 49.75315)
913,103063,Bear Creek Rd at McNaughton Rd,49.89299,-119.54761,POINT (-119.54761 49.89299)
